{
  "contractVersion": "1.0.0",
  "invocationId": "00000000-0000-4000-8000-000000000001",
  "correlationId": "00000000-0000-4000-8000-000000000002",
  "organizationId": "00000000-0000-4000-8000-000000000003",
  "brandId": "00000000-0000-4000-8000-000000000004",
  "purpose": "KNOWLEDGE_EXTRACTION",
  "caller": "KNOWLEDGE_EXTRACTION",
  "promptTemplateId": "fixture.extract",
  "promptTemplateVersion": "1.0.0",
  "trustedInstructionRef": {
    "registryKey": "fixture.extract.instructions",
    "sha256": "aaaaaaaaaaaaaaaaaaaaaaaaaaaaaaaaaaaaaaaaaaaaaaaaaaaaaaaaaaaaaaaa"
  },
  "task": {
    "content": "SYNTHETIC BUSINESS TEXT: fixture item costs 12 units.",
    "evidence": [
      {
        "evidenceId": "00000000-0000-4000-8000-000000000005",
        "sourceArtifactId": "00000000-0000-4000-8000-000000000006",
        "sourceDocumentId": "00000000-0000-4000-8000-000000000007"
      }
    ],
    "requestedFieldRefs": [
      "product.description"
    ],
    "dataClassification": "BUSINESS_INTERNAL"
  },
  "expectedOutputSchemaRef": "urn:ai-brand-os:ai-provider:1.0.0:extraction-output",
  "requirements": {
    "capabilityKey": "fixture.extract",
    "requiredCapabilities": [
      "STRUCTURED_JSON"
    ],
    "requestedModelKey": null
  },
  "policyRef": {
    "id": "fixture-policy",
    "version": "1.0.0"
  },
  "limits": {
    "maxInputTokens": 1000,
    "maxOutputTokens": 500,
    "maxOutputBytes": 4096,
    "timeoutMs": 10000,
    "maxPhysicalAttempts": 3,
    "maxCost": {
      "amount": "0.10",
      "currency": "USD"
    }
  },
  "attempt": {
    "attemptNumber": 1,
    "idempotencyKey": "00000000-0000-4000-8000-000000000008",
    "requestHash": "bbbbbbbbbbbbbbbbbbbbbbbbbbbbbbbbbbbbbbbbbbbbbbbbbbbbbbbbbbbbbbbb"
  },
  "execution": {
    "deadlineAt": "2026-10-18T12:00:00Z",
    "cancellationId": "00000000-0000-4000-8000-000000000009",
    "workRef": {
      "kind": "IMPORT",
      "id": "00000000-0000-4000-8000-000000000002",
      "sourceArtifactId": "00000000-0000-4000-8000-000000000006",
      "jobId": "00000000-0000-4000-8000-000000000010",
      "leaseFence": "fixture-fence-1"
    }
  }
}
